"2019/07/22 10:34:30 AM GMT+2","Infotel","https://drive.google.com/open?authuser=0&usp=forms_web&id=1Mnk8IflsInjZVxBIDB9jXhA41hMpJHn1;https://drive.google.com/open?authuser=0&usp=forms_web&id=1bVVU0e12ZLlQZ0dzeJVmRzEgQmgs-cyk","@Infotel_"," @groupeInfotel","Infotel","Qualité : satisfaire nos clients et collaborateurs et respecter notre environnement. 
Adaptabilité : savoir évoluer, maitriser de nouvelles technologies, améliorer nos pratiques, nos métiers, nos procédures, nos gestions, s'adapter en permanence tout en restant fidèle à nos autres valeurs.
Engagement :respecter nos clients et collaborateurs, respecter les règles, les délais, les engagements, l'environnement. 
Proximité : être proche de nos clients, de leurs préoccupations pour amener la meilleure solution à leurs problèmes; être proche de nos collaborateurs, pour leur assurer la meilleure évolution possible 
","Français","@Infotel_ est pour la seconde fois partenaire du #DevFestToulouse le 3 octobre ! Acteur européen de la transformation numérique des entreprises depuis 40 ans, nous sommes heureux de les compter parmi nous une nouvelle fois","Venez rencontrer l’équipe d’@Infotel_ sur son stand, au programme : échanges, partages et surprises ! Passionnés de #dev , vous êtes attendu ! #DevFestToulouse","Merci @infotel_ d’avoir une nouvelle fois soutenu le #DevFestToulouse, rendez-vous dans quelques jours au #DevFestNantes","Acteur européen de la transformation numérique des entreprises, le groupe Infotel est l’interlocuteur privilégié des directions Informatiques et Métiers de Grands Comptes depuis près de 40 ans.
Infotel leur apporte son expertise reconnue dans la gestion et l’évolution de leur patrimoine informatique mais aussi le conseil auprès des métiers et services innovants intégrant les technologies digitales ainsi qu’une expertise Big Data et mobile.
Infotel développe son savoir-faire dans les secteurs de la Banque, de l’Assurance, de la Retraite, de l’Industrie et des Transports en s’appuyant sur l’innovation et la R&D.

Editeur de logiciels, Infotel déploie par ailleurs toute une gamme de produits pour les grands serveurs, que ce soit en Europe, aux USA ou dans le reste du Monde.
Employant plus de 2 500 personnes, le Groupe, coté sur Euronext Paris, a réalisé en 2018 un chiffre d’affaires de 231 M€ et est en croissance constante.

Pour plus d’informations, rendez-vous sur : http://www.infotel.com
Le groupe est resté fidèle aux valeurs humaines qui ont fait sa réussite : 
	un recrutement sélectif basé sur les compétences ;
	un suivi rigoureux des collaborateurs par des commerciaux-managers ;
	une gestion dynamique de la progression de carrière grâce à des missions valorisantes ;
","https://www.infotel.com/","Notre passion pour l'innovation ainsi que notre cœur de métier en lien direct avec le DevFest nous pousse à devenir une nouvelle fois sponsor. 
Le DevFest est un événement incontournable sur l'IT et une opportunité de rencontrer et d'échanger avec des talents autours des nouvelles technologies. Mais également, d'assister à des conférences de qualités. ","Léa COSTAMAGNA - lea.costamagna@infotel.com - 05.62.74.68.66
Roseline TOURNIER - roseline.tournier@infotel.com - 05.62.74.68.05"
"2019/07/23 2:02:13 PM GMT+2","GitHub","https://drive.google.com/open?authuser=0&usp=forms_web&id=1fKLHYaDL0YM7Vh6Eb0wtBiOwydX4bHGO","@github","","","How people build software. 
GitHub's core values are: Collaboration, Empathy, Quality, Positive Impact, and Shipping. ","Français","","","","GitHub is the developer company. We make it easier for developers to be developers: to work together, to solve challenging problems, and to create the world’s most important technologies.
","https://github.com/","GitHub is focused on developers, the people who code and create software. For this reason, we decided to sponsor DevFest Toulouse. We want to be part of this collaborative community that can come together —as individuals and in teams— to create the future of software and make a difference in the world.  ","Sophie Legrand, marketing manager, sophielegrand@github.com, 0031 06 15 68 52 23"
"2019/07/24 4:48:08 PM GMT+2","OneStock","https://drive.google.com/open?authuser=0&usp=forms_web&id=1kPiESGbScZ_zTKBUxKYHrV8DPBMC4yVl","https://twitter.com/_onestock_fr","https://www.facebook.com/OneStockRetail/","https://www.linkedin.com/company/onestock-france/?originalSubdomain=fr","OneStock unifie les stock web & retail et les ouvre à la vente en ligne et en magasin, avec l’objectif d’éradiquer les ruptures de stock.","Français","","","","Basée en France et au Royaume-Uni, OneStock propose une suite logicielle omnicanale d’Order Management à destination des retailers souhaitant rendre agile la gestion de leurs commandes, offrir la meilleure expérience client et booster leurs ventes.

La société, co-fondée par Romulus, Benoit et Vincent en 2010 est devenue une référence pour les marchands cross-canaux, et compte de nombreux clients en France, au Royaume Uni et plus généralement en Europe.

La société ambitionne de s’étendre toujours plus à l’international.
Sa mission ? Abolir les frontières entre commerce physique et digital.","http://onestock-retail.com","Pour gagner en visibilité et se positionner en tant qu'entreprise à la pointe de la technologie","Mail : rh@onestock-retail.com
Adresse : 8 Rue des Trente Six Ponts, 31400 Toulouse
Téléphone : 05 62 80 21 94"
"2019/07/24 4:54:16 PM GMT+2","commit42","https://drive.google.com/open?authuser=0&usp=forms_web&id=14eCifNhZ4lZLzFfvRuuygBEKoiBU9C3R","commit42","commit42","commit42","Studio d'innovation web spécialisé React, Node, PHP, Magento axé qualité (tests, revues de code...)","Français","","","","Studio d'innovation web
commit42 est spécialisé dans les technologies React, PHP, NodeJS, Magento et PWA.

Nos projets peuvent varier de la maintenance d’une boutique en ligne à la réalisation d’applications métiers spécifiques dont des Web App PWA.","https://www.commit42.com/","C'est notre manière de vous remercier pour ce que vous faites.","contact@commit42.fr"